{
  "schema_version": "2.2",
  "tool": "NetworkSecurityAuditor",
  "tool_version": "5.4.0",
  "timestamp": "2026-07-08T00:00:00Z",
  "host": "HOST01",
  "os": "Windows 11 Enterprise",
  "domain": "EXAMPLE.LOCAL",
  "score": {
    "overall": 85,
    "grade": "B",
    "ransomware": 70,
    "ransomware_grade": "C",
    "domain_maturity": 60,
    "domain_maturity_grade": "D"
  },
  "counts": {
    "total": 3,
    "pass": 1,
    "partial": 1,
    "fail": 1,
    "na": 0,
    "not_assessed": 0,
    "error": 0,
    "critical_failures": 1
  },
  "coverage": {
    "applicable": 3,
    "scored": 3,
    "timed_out": 0,
    "pct": 100.0
  },
  "category_scores": {
    "Endpoint Security": {
      "total": 3,
      "denominator": 3,
      "met": 1,
      "partial": 1,
      "failing": 1,
      "pct": 33.3
    }
  },
  "framework_scores": {
    "NIST 800-171": {
      "mapped": 3,
      "total": 3,
      "denominator": 3,
      "met": 1,
      "partial": 1,
      "failing": 1,
      "not_assessed": 0,
      "pct": 33.3
    }
  },
  "critical_failures": [
    {
      "id": "EP01",
      "label": "Defender / EDR Deployment + ASR Rules",
      "category": "Endpoint Security"
    }
  ],
  "executive_kpis": {
    "assets_discovered": 1,
    "assets_valid": 1,
    "assets_scanned": 1,
    "assets_skipped": 0,
    "assets_failed": 0,
    "coverage": { "numerator": 1, "denominator": 1, "percentage": 100 },
    "freshness": { "fresh": 1, "stale": 0, "unknown": 0, "denominator": 1 },
    "scores": { "average": 85, "median": 85, "population": 1, "population_definition": "this asset when at least one check is Pass, Partial, or Fail" },
    "critical_findings": { "open": 1, "open_denominator": 1, "new": 0, "resolved": 0, "change_denominator": 0, "oldest_high_age_days": null, "oldest_critical_age_days": null, "age_denominator": 0 },
    "exceptions": { "active": 0, "expired": 0, "denominator": 0 },
    "remediation_aging": { "denominator": 1, "not_due": 0, "overdue_1_to_30_days": 0, "overdue_31_to_60_days": 0, "overdue_61_to_90_days": 0, "overdue_91_plus_days": 0, "no_due_date": 1 }
  }
}
